Function,"Symbol, Signal, Signal Date/Price[$]",Exit Signal Date/Price[$],Current Mark to Market and Holding Period,"Win Rate [%], History Tested, Number of Trades","Interval, Confirmation Status",Cancellation Level/Date,"Current Trading Date/Price[$], Current Price vs Signal",Trading Days between Signal and Current Date,"Sigmashell, Success Rate of Past Analysis [%]","Divergence observed with, Signal Type",Maxima Broken Date/Price[$],"Track Level/Price($), Price on Latest Trading day vs Track Level, Signal Type","Reference Upmove or Downmove start Date/Price($), end Date/Price($)",% Change in Price on Latest Trading day vs Price on Trendpulse Breakout day/Earliest Unconfirmed Signal day/Confirmed Signal day,Backtested Returns(Win Trades) [%] (Best/Worst/Avg),"Backtested Max Loss [%], Backtested Worst Single MTM during Hold Period [%]",Backtested Holding Period(Win Trades) (days) (Max./Min./Avg.),Target Exit Date(Win Trades) (Max/Min/Avg.),Backtested Strategy CAGR [%],CAGR of Buy and Hold [%],CAGR difference (Strategy - Buy and Hold) [%],Backtested Strategy Sharpe Ratio,Sharpe Ratio of Buy and Hold,Targets (Historic Rise or Fall to Pivot/Avg % Gain of Historic Winning trades/Exit Rule/Horizontal/F-Stack 1/F-Stack 2/Moving Avg) [$],Support (Recent Extrema/Horizontal/F-Stack 1/F-Stack 2/F-Track 1/F-Track 2/Moving Avg) [$],Latest Past 6 Months Performance[%]/No. of Analysed Trades/Avg Holding Period (days) (Across ALL Assets),Forward Testing Win Rate[%]/No. of Analysed Trades/Avg Holding Period (days) (Across ALL Assets)
FRACTAL TRACK,"SUM.NZ, Long, 2025-12-02 (Price: 12.48)",No Exit Yet,"0.0%, 0 days","96.55%, Past 5 years, 29","Daily, is CONFIRMED on 2025-12-02",Already confirmed,"2025-12-02 (Price: 12.48), 0.0% below",0 days,No Information,No Information,No Information,"23.66% (Price: 12.2582), 1.81% above, Upmove Bounce Back","2025-08-27 (Price: 10.51), 2025-11-18 (Price: 12.8)",No Information,7.52%/0.86%/3.34%,"1.14%, 17.77%",3.1 months/12 days/1.4 month,2026-04-14/2025-12-19/2026-02-02,16.56%,2.28%,14.28%,0.28,0.03,12.4925/12.8968/13.85/13.345/16.7981/18.5763/No Moving Avg Target,12.29/9.1367/11.1928/8.9354/12.5875/12.8318/11.43,94.1%/288/7.3 months (Across ALL Assets),51.67%/60/3.6 months (Across ALL Assets)
OSCILLATOR DELTA,"NVDA, Long, 2025-12-02 (Price: 181.46)",No Exit Yet,"0.0%, 0 days","86.84%, Past 6 years, 38","Daily, is Confirmed on 2025-12-02",No Cancellation Possible,"2025-12-02 (Price: 181.46), 0.0% below",0 days,No Information,No Information,No Information,No Information,No Information,No Information,21.7%/5.08%/10.25%,"14.32%, 16.64%",1.8 month/2 days/9 days,2026-02-19/2025-12-04/2025-12-15,166.42%,81.52%,84.9%,0.34,2.03,194.7247/200.0597/190.53/No Horizontal Resistance/No Next Fib Ext/No Next Fib Ext/No Moving Avg Target,No Recent Minima/13.9695/129.8234/89.3715/182.4801/164.2223/154.1,68.21%/151/1.5 month (Across ALL Assets),63.74%/353/1.4 month (Across ALL Assets)
TRENDPULSE,"AAPL, Long, 2025-12-02 (Price: 286.19)",No Exit Yet,"0.0%, 0 days","81.25%, Past 4 years, 32","Daily, is CONFIRMED on 2025-12-02",Already confirmed,"2025-12-02 (Price: 286.19), 0.0% below",0 days,No Information,No Information,No Information,No Information,No Information,1.09% above/0.0% below/0.0% below,7.36%/0.78%/3.4%,"13.77%, 30.22%",2.6 months/4 days/23 days,2026-03-24/2025-12-07/2026-01-04,8.33%,26.41%,-18.08%,0.18,0.92,289.3667/295.9205/340.15/No Horizontal Resistance/275.1059/297.1089/No Moving Avg Target,266.25/136.57/248.4166/236.3611/259.4362/242.2514/227.61,88.26%/298/1 month (Across ALL Assets),82.89%/637/28 days (Across ALL Assets)
FRACTAL TRACK,"SFTBY, Short, 2025-12-02 (Price: 51.78)",No Exit Yet,"-0.0%, 0 days","100.0%, Past 13 years, 4","Quarterly, is CONFIRMED on 2025-12-02",No Cancellation Possible,"2025-12-02 (Price: 51.78), 0.0% below",0 days,No Information,No Information,No Information,"50.0% (Price: 53.39), 3.02% below, Upmove Break Below","2022-06-30 (Price: 16.78), 2025-12-02 (Price: 90.0)",No Information,22.05%/16.72%/18.57%,"0%, 22.05%",6.5 months/2.2 months/3.3 months,2026-09-10/2026-03-06/2026-04-22,14.54%,5.4%,9.14%,7.65,0.48,55.8085/42.1645/7.85/16.82/48.0625/43.9946/43.32,63.3/16.82/48.0625/43.9946/44.75/32.4491/No Moving Avg Support,0.0%/1/3 months (Across ALL Assets),53.33%/15/3.1 months (Across ALL Assets)
FRACTAL TRACK,"KWEB, Short, 2025-12-02 (Price: 37.6)",No Exit Yet,"-0.0%, 0 days","88.89%, Past 12 years, 9","Monthly, is CONFIRMED on 2025-12-02",No Cancellation Possible,"2025-12-02 (Price: 37.6), 0.0% below",0 days,No Information,No Information,No Information,"23.66% (Price: 38.4709), 2.26% below, Upmove Break Below","2024-01-31 (Price: 22.68), 2025-10-31 (Price: 43.365)",No Information,10.4%/3.11%/6.98%,"19.33%, 16.82%",2.2 months/21 days/1.2 month,2026-03-07/2026-01-01/2026-01-23,21.98%,5.3%,16.68%,0.3,0.14,34.5619/34.9755/25.19/24.5062/No F-Stack Support/No F-Stack Support/36.34,42.01/24.5062/No F-Stack Support/No F-Stack Support/39.3865/41.3508/No Moving Avg Support,85.71%/7/1.5 month (Across ALL Assets),38.89%/18/2.4 months (Across ALL Assets)
FRACTAL TRACK,"NFLX, Short, 2025-12-02 (Price: 109.35)",No Exit Yet,"-0.0%, 0 days","100.0%, Past 23 years, 7","Quarterly, was CONFIRMED on None",No Cancellation Possible,"2025-12-02 (Price: 109.35), 0.0% below",0 days,No Information,No Information,No Information,"23.66% (Price: 106.2331), 2.93% above, Upmove Break Below","2022-06-30 (Price: 16.271), 2025-06-30 (Price: 134.115)",No Information,57.17%/10.52%/34.09%,"-0.0%, 57.17%",2.2 months/2.2 months/2.2 months,2026-03-07/2026-03-06/2026-03-06,106.75%,5.4%,101.35%,1.28,0.89,210.2582/72.0726/38.64/34.8663/101.6781/77.3488/No Moving Avg Target,133.91/34.8663/101.6781/77.3488/106.2331/89.0986/113.43,0.0%/1/3 months (Across ALL Assets),53.33%/15/3.1 months (Across ALL Assets)
