"Symbol, Signal, Signal Date/Price[$]",Exit Signal Date/Price[$],Current Mark to Market and Holding Period,"Win Rate [%], History Tested, Number of Trades","Interval, Confirmation Status",Cancellation Level/Date,"Current Trading Date/Price[$], Current Price vs Signal",Trading Days between Signal and Current Date,Backtested Returns(Win Trades) [%] (Best/Worst/Avg),"Backtested Max Loss [%], Backtested Worst Single MTM during Hold Period [%]",Backtested Holding Period(Win Trades) (days) (Max./Min./Avg.),Target Exit Date (Farthest./Earliest./Avg.),Backtested Strategy CAGR [%],CAGR of Buy and Hold [%],CAGR difference (Strategy - Buy and Hold) [%],Backtested Strategy Sharpe Ratio,Sharpe Ratio of Buy and Hold,Targets (Historic Rise or Fall to Pivot/Avg % Gain of Historic Winning trades/Exit Rule/Horizontal/F-Stack 1/F-Stack 2) [$],Support (Recent Extrema/Horizontal/F-Stack 1/F-Stack 2/F-Track 1/F-Track 2) [$],Moving Average (50-days/200-days),Latest Past 6 Months Performance[%]/No. of Analysed Trades/Avg Holding Period (days) (Across ALL Assets),Forward Testing Win Rate[%]/No. of Analysed Trades/Avg Holding Period (days) (Across ALL Assets)
"ATD.TO, Long, 2025-10-31 (Price: 71.28)",No Exit Yet,"0.0%, 0 days","80.0%, Past 5 years, 10","Daily, is CONFIRMED on 2025-10-31",No Cancellation Possible,"2025-10-31 (Price: 71.28), 0.0% below",0 days,19.21%/0.22%/9.13%,"9.62%, 20.63%",173 days/24 days/80 days,2026-07-08/2025-12-04/2026-02-23,12.48%,10.16%,2.32%,0.63,0.39,73.5681/77.7879/75.68/85.51/100.8822/111.119,69.94/45.49/69.1528/55.4059/87.7049/90.1476,72.8/71.85,76.32%/76/130 days (Across ALL Assets),76.19%/252/112 days (Across ALL Assets)
"GBPUSD=X, Long, 2025-10-30 (Price: 1.3195)",No Exit Yet,"-0.31%, 1 days","90.91%, Past 5 years, 11","Daily, was CONFIRMED on 2025-10-30",No Cancellation Possible,"2025-10-31 (Price: 1.3154), 0.31% below",1 days,5.08%/0.79%/2.94%,"10.95%, 16.78%",118 days/22 days/57 days,2026-04-18/2025-11-30/2026-01-20,3.7%,1.15%,2.55%,0.27,-0.35,1.3392/1.3583/1.35/1.4232/2.4421/3.2078,1.32/1.1912/No F-Stack Support/No F-Stack Support/No F-Track Level/No F-Track Level,1.34/1.32,76.32%/76/130 days (Across ALL Assets),76.19%/252/112 days (Across ALL Assets)
"XLV, Long, 2025-09-29 (Price: 135.9)",2025-10-29 (Price: 143.98),"5.95%, 22 days","100.0%, Past 5 years, 5","Daily, was CONFIRMED on 2025-09-29",No Cancellation Possible,"2025-10-31 (Price: 144.25), 6.14% above",24 days,13.81%/0.37%/8.58%,"0%, 16.06%",565 days/48 days/218 days,2027-12-26/2025-12-07/2026-08-10,9.64%,5.51%,4.13%,1.54,0.16,142.5863/147.5602/145.07/149.295/174.1807/202.706,134.13/121.6312/117.2225/81.225/No F-Track Level/No F-Track Level,140.39/139.04,76.32%/76/130 days (Across ALL Assets),76.19%/252/112 days (Across ALL Assets)
"CNU.NZ, Long, 2025-02-02 (Price: 8.66)",2025-10-19 (Price: 9.2),"6.24%, 184 days","83.33%, Past 13 years, 6","Weekly, was CONFIRMED on 2025-02-02",No Cancellation Possible,"2025-10-31 (Price: 9.36), 8.08% above",194 days,63.81%/17.58%/37.02%,"0.15%, 58.1%",964 days/319 days/486 days,2028-11-29/2026-05-10/2027-01-06,12.46%,8.09%,4.37%,0.91,0.29,9.2125/11.8659/10.54/9.2512/No Next Fib Ext/No Next Fib Ext,8.6/6.0983/No F-Stack Support/No F-Stack Support/No F-Track Level/No F-Track Level,9.47/8.68,100.0%/5/521 days (Across ALL Assets),80.9%/89/282 days (Across ALL Assets)
"MX.TO, Long, 2024-08-18 (Price: 61.73)",2025-10-19 (Price: 47.63),"-22.84%, 304 days","80.0%, Past 15 years, 5","Weekly, was CONFIRMED on 2024-08-18",No Cancellation Possible,"2025-10-31 (Price: 55.2), 10.58% below",314 days,164.22%/34.23%/77.6%,"45.58%, 82.88%",824 days/519 days/662 days,2027-11-24/2026-09-08/2027-04-03,8.84%,5.34%,3.5%,0.47,0.25,62.1189/109.6325/85.88/74.465/104.8718/122.9238,57.93/38.425/48.7635/45.8359/No F-Track Level/No F-Track Level,51.78/51.65,100.0%/5/521 days (Across ALL Assets),80.9%/89/282 days (Across ALL Assets)
